timestamp,text,sentiment,user,platform,hashtags,retweets,likes,country,year,month,day,hour
2020-07-08 19:30:00,streaming latest web series viewer engrossed characters journey feeling sense connection empathy, Engagement , WebSeriesViewerCharacterConnection , Facebook , #Engagement #WebSeriesJourney ,30.0,60.0, Canada ,2020,7,8,19
2017-09-18 21:45:00,film festival indie filmmakers creation receives standing ovation evoking pride sense accomplishment, Pride , IndieFilmmakerFestivalSuccess , Twitter , #Pride #IndieFilmSuccess ,22.0,45.0, Australia ,2017,9,18,21
2021-01-15 18:00:00,watching heartwarming family drama tears flow freely characters overcome challenges leaving viewer warm glow, Touched , DramaEnthusiastHeartwarmingMoments , Instagram , #Touched #FamilyDramaMoments ,28.0,55.0, India ,2021,1,15,18
2016-02-28 20:30:00,oscars actor graciously accepts award radiating joy gratitude recognition outstanding performance, Gratitude , AwardWinningActorOscarsRecipient , Facebook , #Gratitude #OscarWinningMoment ,18.0,35.0, USA ,2016,2,28,20
2022-04-20 17:30:00,discovering hidden gem world documentaries viewer enlightened inspired feeling renewed sense curiosity, Inspiration , DocumentaryEnthusiastHiddenGemFinder , Twitter , #Inspiration #HiddenGemDiscovery ,22.0,45.0, France ,2022,4,20,17
2019-11-05 21:15:00,movie credits roll viewer experiences mix awe contemplation pondering deeper meanings woven storyline, Contemplation , FilmBuffContemplativeViewer , Instagram , #Contemplation #DeepMeanings ,28.0,55.0, Germany ,2019,11,5,21
2015-07-12 22:00:00,bingewatching thrilling crime series suspense keeps viewer edge seat creating rush adrenaline, Suspense , CrimeSeriesEnthusiastThrillSeeker , Facebook , #Suspense #CrimeSeriesThrills ,35.0,70.0, Japan ,2015,7,12,22
2020-09-10 19:45:00,closing scene unfolds sense satisfaction washes over completing cinematic journey profound fulfilling ending, Satisfaction , FilmCriticSatisfactionSeeker , Twitter , #Satisfaction #FulfillingEnding ,22.0,45.0, Brazil ,2020,9,10,19
2018-07-15 21:30:00,celebrating historic victory world cup nation erupts joy united triumph football team, Joy , FootballFanWorldCupCelebration , Instagram , #Joy #WorldCupTriumph ,40.0,80.0, Brazil ,2018,7,15,21
2020-08-08 19:45:00,olympics athletes perseverance shines through earning gold medal inspiring generation remarkable achievement, Inspiration , OlympicsEnthusiastGoldMedalWinner , Twitter , #Inspiration #OlympicAchievement ,35.0,70.0, USA ,2020,8,8,19
2019-06-25 22:15:00,cricket championship nailbiting finish leaves fans edge seats experiencing rollercoaster emotions, Excitement , CricketFanChampionshipThrills , Facebook , #Excitement #CricketChampionship ,30.0,60.0, India ,2019,6,25,22
2021-11-07 17:30:00,witnessing recordbreaking marathon spectators filled awe admiration endurance dedication runners, Admiration , MarathonSpectatorRecordBreaking , Instagram , #Admiration #MarathonRecords ,22.0,45.0, Kenya ,2021,11,7,17
2017-09-10 20:15:00,tennis grand slam fierce rivalry unfolds captivating fans display skill sportsmanship world stage, Captivation , TennisEnthusiastGrandSlamDrama , Twitter , #Captivation #TennisRivalry ,28.0,55.0, UK ,2017,9,10,20
2022-06-20 21:00:00,cheering underdog basketball finals crowd erupts applause team defies odds claim championship title, Triumph , BasketballFanUnderdogTriumph , Facebook , #Triumph #BasketballFinals ,18.0,35.0, USA ,2022,6,20,21
2016-04-10 18:30:00,golf tournament golfers precision focus lead stunning victory leaving spectators awe exceptional skill, Awe , GolfEnthusiastPrecisionVictory , Instagram , #Awe #GolfVictory ,22.0,45.0, Scotland ,2016,4,10,18
2019-11-24 19:45:00,experiencing thrill highspeed formula 1 race fans edge seats drivers compete championship, Thrill , F1FanHighSpeedRaceExcitement , Twitter , #Thrill #Formula1Championship ,28.0,55.0, Germany ,2019,11,24,19
2015-09-28 22:30:00,cycling world championship climber conquers challenging terrains symbolizing determination achievement odds, Determination , CyclingEnthusiastWorldChampion , Facebook , #Determination #CyclingChampion ,35.0,70.0, Italy ,2015,9,28,22
2020-12-12 20:00:00,witnessing heartwarming comeback hockey finals fans share tears joy team secures historic victory adversity, Heartwarming , HockeyFanComebackVictory , Instagram , #Heartwarming #HockeyFinalsComeback ,22.0,45.0, Canada ,2020,12,12,20
2019-11-02 18:45:00,series defeats soccer team faces disappointment struggling find silver lining challenging season, Disappointment , SoccerFanTeamDefeats , Twitter , #Disappointment #SoccerDefeats ,40.0,80.0, Brazil ,2019,11,2,18
2018-07-10 21:15:00,tennis tournament highly anticipated player experiences setback leaving fans shock questioning unforeseen turn events, Frustration , TennisEnthusiastUnexpectedSetback , Instagram , #Frustration #TennisSetback ,35.0,70.0, USA ,2018,7,10,21
2020-09-18 19:30:00,facing defeat championship boxer reflects challenges vowing return stronger determined next bout, Reflection , BoxingFanChampionshipDefeat , Facebook , #Reflection #BoxingDefeat ,30.0,60.0, UK ,2020,9,18,19
2017-05-15 22:00:00,midst cycling race tire blowout leads frustration cyclist valiantly tries overcome unexpected obstacle, Obstacle , CyclingEnthusiastTireBlowout , Twitter , #Obstacle #CyclingFrustration ,22.0,45.0, France ,2017,5,15,22
2021-04-05 20:15:00,gymnasts unexpected fall routine sparks wave sympathy audience highlighting vulnerability sports, Sympathy , GymnasticsFanRoutineFall , Instagram , #Sympathy #GymnasticsFall ,28.0,55.0, Japan ,2021,4,5,20
2016-08-20 18:30:00,golf tournament missed crucial putt results defeat causing golfer reflect pressure highstakes competition, Pressure , GolfEnthusiastMissedPutt , Facebook , #Pressure #GolfDefeat ,18.0,35.0, USA ,2016,8,20,18
2019-02-12 19:45:00,experiencing series losses basketball season team grapples frustration determined turn tide renewed effort, Renewed Effort , BasketballFanTeamLosses , Twitter , #RenewedEffort #BasketballStruggles ,22.0,45.0, Canada ,2019,2,12,19
2015-06-28 20:00:00,despite meticulous training swimmer faces disappointment splitsecond miscalculation costs lead crucial race, Miscalculation , SwimmingEnthusiastRaceSetback , Instagram , #Miscalculation #SwimmingDisappointment ,28.0,55.0, Australia ,2015,6,28,20
2022-01-08 21:30:00,weightlifters failed attempt personal record results frustration highlighting challenging nature pushing physical limits, Challenge , WeightliftingFanFailedRecord , Facebook , #Challenge #WeightliftingFailure ,35.0,70.0, Germany ,2022,1,8,21
2018-12-15 20:15:00,midst soccer match unexpected goal creates moment despair player teammates console encourage them, Despair , SoccerPlayerOwnGoalMoment , Twitter , #Despair #OwnGoal ,22.0,45.0, Spain ,2018,12,15,20
2021-07-10 19:00:00,serene beauty sunset nature unfolds canvas colors evoking sense tranquility wonder, Tranquility , NatureEnthusiastSunsetWonder , Instagram , #Tranquility #SunsetBeauty ,40.0,80.0, Canada ,2021,7,10,19
2019-09-28 20:30:00,embarking spontaneous road trip traveler discovers hidden gems creating memories cherished lifetime, Adventure , TravelEnthusiastRoadTripDiscovery , Twitter , #Adventure #RoadTripMemories ,35.0,70.0, USA ,2019,9,28,20
2022-03-15 18:45:00,amidst bustling city quiet caf becomes sanctuary reflection cup coffee brings solace wandering mind, Solace , UrbanExplorerCafeSolitude , Facebook , #Solace #CafeReflection ,30.0,60.0, France ,2022,3,15,18
2017-11-05 21:15:00,exploring vibrant street art cultural neighborhood mural tells story infusing city creativity expression, Creativity , ArtEnthusiastStreetArtExploration , Instagram , #Creativity #StreetArtVibes ,22.0,45.0, Brazil ,2017,11,5,21
2020-05-20 16:30:00,world science breakthrough discovery unfolds pushing boundaries knowledge opening new frontiers exploration, Breakthrough , ScienceEnthusiastDiscoveryMoment , Twitter , #Breakthrough #ScientificDiscovery ,28.0,55.0, Germany ,2020,5,20,16
2016-08-22 19:45:00,connecting melody live orchestra music enthusiast experiences symphony resonates deep within soul, Harmony , MusicLoverLiveOrchestraExperience , Facebook , #Harmony #OrchestraMelody ,18.0,35.0, UK ,2016,8,22,19
2023-04-10 17:15:00,embracing aroma freshly baked bread home chef finds joy art baking creating delicious memories loved ones, Joy in Baking , HomeBakerDeliciousMemories , Instagram , #JoyInBaking #HomemadeDelights ,22.0,45.0, India ,2023,4,10,17
2015-12-18 18:00:00,wandering historical museum history enthusiast becomes immersed tales past envisioning bygone eras, Envisioning History , HistoryBuffMuseumExploration , Twitter , #EnvisioningHistory #MuseumTales ,28.0,55.0, Italy ,2015,12,18,18
2021-10-08 20:30:00,realm literature captivating novel transports reader distant lands weaving tapestry imagination escape, Imagination , BookwormCaptivatingNovelEscape , Facebook , #Imagination #LiteraryEscape ,35.0,70.0, Japan ,2021,10,8,20
2019-03-22 21:45:00,capturing essence bustling market photographer freezes moments time frame telling unique vibrant story, Vibrancy , PhotographyEnthusiastMarketMoments , Instagram , #Vibrancy #MarketStories ,22.0,45.0, Australia ,2019,3,22,21
2018-06-15 22:00:00,underneath city lights dancer expresses emotions graceful movements creating mesmerizing performance night sky, Mesmerizing , DanceEnthusiastCityNightPerformance , Twitter , #Mesmerizing #NightDancePerformance ,40.0,80.0, USA ,2018,6,15,22
2019-08-28 19:30:00,heart bustling market street food connoisseur indulges culinary adventure savoring diverse flavors aromas, Culinary Adventure , FoodieMarketStreetFoodExploration , Instagram , #CulinaryAdventure #StreetFoodDelights ,35.0,70.0, Thailand ,2019,8,28,19
2022-12-01 17:45:00,first snowflake descends winter enthusiast eagerly prepares season frosty delights anticipating magic snowcovered landscapes, Winter Magic , SnowLoverWinterEnthusiast , Facebook , #WinterMagic #SnowyLandscapes ,30.0,60.0, Canada ,2022,12,1,17
2017-04-10 21:15:00,amidst pages captivating mystery novel reader unravels clues secrets experiencing thrilling journey suspense revelation, Thrilling Journey , MysteryBookwormSuspensefulRead , Twitter , #ThrillingJourney #MysteryNovel ,22.0,45.0, UK ,2017,4,10,21
2020-05-15 18:30:00,surrounded vibrant colors flower garden gardener nurtures blossoms finding joy beauty natures everchanging canvas, Nature's Beauty , GardeningEnthusiastFlowerGarden , Instagram , #NaturesBeauty #FloralJoy ,28.0,55.0, Australia ,2020,5,15,18
2016-09-22 20:00:00,astronomy observatory stargazer marvels vastness cosmos contemplating mysteries hidden within celestial expanse, Celestial Wonder , AstronomyEnthusiastStargazing , Facebook , #CelestialWonder #Stargazing ,18.0,35.0, USA ,2016,9,22,20
2023-02-12 19:45:00,engulfed aroma freshly brewed coffee writer finds inspiration every sip embarking journey creativity prose, Creative Inspiration , CoffeeLoverWritersRetreat , Twitter , #CreativeInspiration #CoffeeJourney ,22.0,45.0, France ,2023,2,12,19
2015-11-10 21:00:00,realm fashion designer unveils collection tells story blending innovation tradition runway creativity, Runway Creativity , FashionEnthusiastDesignerShowcase , Instagram , #RunwayCreativity #FashionInnovation ,28.0,55.0, Italy ,2015,11,10,21
2021-07-20 18:15:00,waves crash shore surfer embraces thrill riding oceans energy capturing essence freedom wave, Ocean's Freedom , SurfingEnthusiastWaveRider , Facebook , #OceansFreedom #SurfingThrills ,22.0,45.0, Brazil ,2021,7,20,18
2019-04-18 20:30:00,exploring historical architecture ancient city traveler transported bygone era monument whispers tales past, Whispers of the Past , HistoryExplorerAncientCityTour , Twitter , #WhispersOfThePast #HistoricalTour ,35.0,70.0, Greece ,2019,4,18,20
2023-05-20 19:45:00,successfully avoided eye contact crush hallway mission accomplished teencrush stealthmode, Excitement , CrushAvoider , Twitter , #CrushStruggles #AvoidingEyeContact ,15.0,30.0, USA,2023,5,20,19
2023-05-21 21:00:00,ran snacks movie marathon crisis level emergency movienightstruggles teenproblems, Boredom , MovieBuff , Instagram , #SnackCrisis #TeenLife ,18.0,35.0, Canada,2023,5,21,21
2023-05-22 14:30:00,spent hour choosing perfect filter selfie struggle instagram aesthetic real selfiequeen teenvibes, Joy , SelfieAddict , Facebook , #SelfieStruggle #TeenConfessions ,22.0,45.0, UK,2023,5,22,14
2023-05-23 16:45:00,lost headphones again vanish thin air headphonemystery teenlife, Frustration , AudioExplorer , Twitter , #TeenProblems #LostHeadphones ,20.0,40.0, USA,2023,5,23,16
2023-05-24 13:15:00,decided study exams ended making memes studying instead procrastination level expert procrastinationnation teenconfessions, Surprise , MemeCreator , Instagram , #StudyingMemes #TeenLife ,25.0,50.0, Canada,2023,5,24,13
2023-05-25 19:00:00,got dressed day remembered saturday oops weekendvibes teenstruggles, Indifference , FashionBlunder , Facebook , #WeekendOops #TeenFashion ,20.0,40.0, USA,2023,5,25,19
2023-05-26 14:20:00,survived group project without drama miracles happen groupprojectsuccess teenachievements, Satisfaction , GroupGenius , Twitter , #TeenSuccess #ProjectMiracle ,28.0,55.0, UK,2023,5,26,14
2023-05-27 21:15:00,entered kitchen intention cook left bag chips cooking overrated anyway masterchefintraining teenhumor, Disgust , ChipExplorer , Instagram , #TeenChef #CookingFail ,22.0,45.0, Canada,2023,5,27,21
2023-05-28 12:00:00,staring clock class waiting bell ring like exciting event day classcountdown teenlife, Surprise , ExcitementSeeker , Facebook , #ClassEvent #TeenExcitement ,18.0,35.0, USA,2023,5,28,12
2023-05-29 23:30:00,discovered new book series spent whole night reading needs sleep anyway bookwormlife latenightreading, Joy , NightReader , Twitter , #BookDiscoveries #TeenReading ,30.0,60.0, UK,2023,5,29,23
2023-05-30 20:45:00,bought new video game played hours forgot eat ultimate gaming session gamerlife nofoodgaming, Excitement , GamingEnthusiast , Instagram , #GameOn #TeenGamer ,22.0,45.0, USA,2023,5,30,20
2023-05-31 15:30:00,spent day bingewatching new series productivity level zero lazyday tvseriesmarathon, Joy , LazyWatcher , Facebook , #BingeWatchDay #TeenLife ,35.0,70.0, Canada,2023,5,31,15
2023-06-01 18:00:00,caught latest fashion trends planning shopping spree fashionista trendyteen, Excitement , TrendExplorer , Twitter , #FashionGoals #TeenStyle ,20.0,40.0, USA,2023,6,1,18
2023-06-02 14:30:00,decided learn new instrument day one still trying figure hold it musicnovice learningjourney, Frustration , MusicalExplorer , Instagram , #InstrumentLearning #TeenMusic ,28.0,55.0, UK,2023,6,2,14
2023-06-03 21:15:00,spent hours creating perfect playlist every mood music therapy playlistmaker teenmusiclover, Joy , MusicAficionado , Facebook , #MusicTherapy #TeenPlaylist ,22.0,45.0, Canada,2023,6,3,21
2023-06-04 19:30:00,successfully cooked gourmet meal family chef skills unlocked chefmode teenchef, Pride , HomeChef , Twitter , #CookingSuccess #TeenCook ,25.0,50.0, USA,2023,6,4,19
2023-06-05 10:00:00,spontaneously booked weekend getaway adventure awaits travelbug weekendescape, Excitement , AdventureSeeker , Instagram , #GetawayGoals #TeenTravel ,18.0,35.0, UK,2023,6,5,10
2023-06-06 22:30:00,attended concert danced night away music heartbeat life concertvibes danceallnight, Joy , DanceEnthusiast , Facebook , #MusicMagic #TeenConcert ,28.0,55.0, Canada,2023,6,6,22
2023-06-07 12:45:00,rediscovered childhood cartoons nostalgiafilled marathon cartoonnostalgia teenmemories, Joy , NostalgiaExplorer , Twitter , #ChildhoodMemories #TeenCartoons ,22.0,45.0, USA,2023,6,7,12
2023-06-08 16:00:00,embarked diy home decor project lets hope turns better last time diyadventure teenhomedecor, Excitement , HomeDecorator , Instagram , #DIYGoals #TeenCreative ,35.0,70.0, UK,2023,6,8,16
2023-06-09 14:00:00,spent afternoon museum pretending cultured art enthusiast making museumday teenartlover, Curiosity , ArtExplorer , Facebook , #CulturalDay #TeenCuriosity ,20.0,40.0, USA,2023,6,9,14
2023-06-10 17:30:00,started blog random thoughts musings blogging new diary bloggerlife teenblogger, Curiosity , ThoughtfulBlogger , Twitter , #BloggingJourney #TeenThoughts ,30.0,60.0, Canada,2023,6,10,17
2023-06-11 15:30:00,relishing peaceful afternoon classic novel quiet moments best moments booklover peacefulafternoon, Contentment , NovelEnthusiast , Instagram , #QuietMoments #BookishEscape ,35.0,70.0, USA,2023,6,11,15
2023-06-12 18:00:00,reflecting lifetime memories wrinkle tells story embracing beauty aging lifereflections beautyinaging, Gratitude , WiseSoul , Twitter , #AgingGracefully #Memories ,28.0,55.0, UK,2023,6,12,18
2023-06-13 14:45:00,exploring world digital art never late discover new passions digitalartistry latebloomer, Curiosity , ArtAdventurer , Facebook , #ArtDiscovery #SeniorArtist ,22.0,45.0, Canada,2023,6,13,14
2023-06-14 19:30:00,savoring flavors homecooked meal simple joys heart happiness homecooking simplejoys, Contentment , HomeChefSenior , Instagram , #HappinessInFood #SeniorLife ,25.0,50.0, USA,2023,6,14,19
2023-06-15 12:15:00,embarking journey learning new language mind stays young every new word languagelearning nevertoolate, Curiosity , LinguisticExplorer , Twitter , #MindEnrichment #SeniorLearning ,30.0,60.0, UK,2023,6,15,12
2023-06-16 21:45:00,attended classical music concert feeling timeless melodies resonate music transcends generations classicalmusic timelessmelodies, Joy , MusicConnoisseur , Facebook , #MusicLover #SeniorConcert ,18.0,35.0, Canada,2023,6,16,21
2023-06-17 15:00:00,capturing beauty nature photography every snapshot treasure naturephotography seniorphotographer, Joy , PhotographySenior , Instagram , #NatureCapture #SeniorMoments ,35.0,70.0, USA,2023,6,17,15
2023-06-18 11:30:00,reconnecting old friends cup tea friendship true essence companionship oldfriends companionship, Contentment , TeaTimeSenior , Twitter , #FriendshipGoals #SeniorBonding ,28.0,55.0, UK,2023,6,18,11
2023-06-19 16:30:00,embarked road trip revisit cherished places past nostalgia ultimate travel companion roadtrip nostalgiatour, Joy , RoadTripSenior , Facebook , #CherishedPlaces #SeniorTravel ,22.0,45.0, Canada,2023,6,19,16
2023-06-20 14:20:00,joined community choir harmonizing fellow voices music creates bonds withstand time communitychoir harmonyinaging, Joy , ChoirEnthusiast , Instagram , #MusicHarmony #SeniorVoices ,20.0,40.0, USA,2023,6,20,14
2023-06-21 19:00:00,exploring art meditation finding tranquility stillness mind meditationjourney tranquilmind, Contentment , MeditationSenior , Twitter , #MindfulLiving #SeniorCalm ,18.0,35.0, UK,2023,6,21,19
2023-06-22 13:45:00,taking stroll garden appreciating beauty blooming flowers natures wonders never cease gardenwalk floralbeauty, Contentment , GardenEnthusiast , Facebook , #NatureWonders #SeniorGarden ,25.0,50.0, USA,2023,6,22,13
2023-06-23 18:45:00,sipping favorite vintage wine sip telling story years gone by cheers life welllived winelover vintagecheers, Contentment , WineConnoisseur , Instagram , #LifeWellLived #SeniorWine ,28.0,55.0, UK,2023,6,23,18
2023-06-24 16:15:00,participated community art class unleashing creativity golden years art age limit artclass seniorartistry, Joy , ArtisticSenior , Twitter , #CreativityAtAnyAge #SeniorCreativity ,22.0,45.0, Canada,2023,6,24,16
2023-06-25 20:30:00,embarking journey writing memoir documenting lifetime experiences every story matters memoirwriting seniorstories, Gratitude , MemoiristSenior , Facebook , #LifetimeExperiences #SeniorMemoir ,35.0,70.0, USA,2023,6,25,20
2023-06-26 14:00:00,attended lecture history always fascinated lessons past learning lifelong adventure historylecture seniorlearning, Curiosity , HistoryEnthusiast , Instagram , #LifetimeAdventure #SeniorCuriosity ,30.0,60.0, UK,2023,6,26,14
2023-06-27 17:45:00,rediscovered joy cooking traditional family recipes kitchen place cherished memories familyrecipes seniorcooking, Contentment , FamilyChefSenior , Twitter , #KitchenMemories #SeniorCulinary ,20.0,40.0, USA,2023,6,27,17
2023-06-28 22:15:00,joined nature photography club capturing beauty great outdoors every click connection nature naturephotography seniorphotographer, Joy , NaturePhotographySenior , Facebook , #OutdoorBeauty #SeniorClicks ,18.0,35.0, UK,2023,6,28,22
2023-06-29 16:30:00,attended jazz concert swayed rhythm timeless tunes music constant companion golden years jazzconcert seniormusic, Joy , JazzMusicLover , Instagram , #TimelessTunes #SeniorJazz ,25.0,50.0, USA,2023,6,29,16
2023-06-30 19:30:00,joined writing group penning thoughts reflections writing journey depths soul writinggroup seniorwriter, Gratitude , SeniorWordsmith , Twitter , #SoulfulWriting #SeniorReflections ,28.0,55.0, UK,2023,6,30,19
2023-07-01 14:00:00,embarked solo travel adventure discovering beauty new places pace solotravel seniorexplorer, Excitement , SoloAdventurer , Instagram , #DiscoverNewPlaces #SeniorTravel ,30.0,60.0, USA,2023,7,1,14
2023-07-02 18:30:00,attended vintage car show reminiscing classics ruled roads nostalgia every rev vintagecars classicrides, Joy , CarEnthusiastSenior , Facebook , #RoadTripDownMemoryLane #SeniorCars ,22.0,45.0, UK,2023,7,2,18
2023-07-03 12:45:00,started community garden growing plants friendships too green thumbs unite communitygarden seniorgardener, Joy , GreenThumbSenior , Twitter , #GardenFriends #SeniorGreenThumb ,28.0,55.0, Canada,2023,7,3,12
2023-07-04 17:00:00,hosted family dinner laughter echoed louder clinking utensils family heart happiness familydinner seniorhost, Contentment , FamilyHostSenior , Instagram , #HeartwarmingMoments #SeniorFamily ,35.0,70.0, USA,2023,7,4,17
2023-07-05 20:15:00,enrolled dance class seniors moving rhythm life age number dance floor danceclass seniordancer, Joy , DanceEnthusiastSenior , Twitter , #DanceLife #SeniorMoves ,18.0,35.0, UK,2023,7,5,20
2023-07-06 14:30:00,visited art gallery appreciating brushstrokes tell tales creativity art eternal companion artgallery seniorartlover, Joy , ArtGalleryVisitor , Facebook , #CreativeExpressions #SeniorArt ,25.0,50.0, USA,2023,7,6,14
2023-07-07 19:45:00,started book club seniors discussions lively characters novels bookclub seniorreaders, Joy , SeniorBookClub , Instagram , #BookishTalks #SeniorBookworms ,22.0,45.0, UK,2023,7,7,19
2023-07-08 16:00:00,hosted picnic park basking warmth friendship sunshine simple joys timeless memories parkpicnic seniorjoy, Contentment , SeniorPicnicHost , Twitter , #FriendshipSunshine #SeniorMemories ,30.0,60.0, Canada,2023,7,8,16
2023-07-09 22:30:00,participated local theater production proving stage belongs every age theaterproduction senioractor, Joy , SeniorActor , Facebook , #StagePassion #SeniorTheater ,20.0,40.0, USA,2023,7,9,22
2023-07-10 14:20:00,embarked hiking adventure conquering trails relishing beauty nature age number mountaintop hikingadventure seniorhiker, Excitement , SeniorHikerExplorer , Instagram , #NatureTrailBlazer #SeniorExplorer ,28.0,55.0, UK,2023,7,10,14
2023-07-11 18:45:00,hosted photography exhibition featuring snapshots life welllived every photo story tell photographyexhibition seniorphotographer, Gratitude , SeniorPhotographerExhibitor , Twitter , #LifeInPictures #SeniorExhibition ,22.0,45.0, Canada,2023,7,11,18
2023-07-12 13:45:00,joined seniors cycling club feeling wind hair freedom open road cyclingclub seniorcyclist, Excitement , SeniorCyclingEnthusiast , Facebook , #OpenRoadAdventures #SeniorCycling ,25.0,50.0, USA,2023,7,12,13
2023-07-13 20:00:00,attended wine tasting event savoring richness flavors age like fine wine cheers golden years winetasting seniorwinelover, Joy , SeniorWineConnoisseur , Instagram , #AgedToPerfection #SeniorCheers ,35.0,70.0, UK,2023,7,13,20
2023-07-14 16:15:00,started learning ballroom dancing gliding gracefully across dance floor ageless elegance every step ballroomdancing seniordancer, Joy , SeniorBallroomDancer , Twitter , #GracefulMoves #SeniorDance ,20.0,40.0, USA,2023,7,14,16
2023-07-15 19:30:00,organized community painting event turning blank canvases masterpiece shared creativity paintingevent seniorartist, Joy , SeniorPaintingOrganizer , Facebook , #CommunityArt #SeniorCreativity ,28.0,55.0, Canada,2023,7,15,19
2023-07-16 14:00:00,hosted memory lane evening old friends reminiscing adventures shaped lives memorylane seniorreminiscing, Gratitude , SeniorMemoriesHost , Instagram , #FriendshipAdventures #SeniorNostalgia ,30.0,60.0, USA,2023,7,16,14
2023-07-17 22:15:00,joined seniors astronomy club stargazing finding wonder vastness cosmos astronomyclub seniorstargazer, Curiosity , SeniorStargazer , Twitter , #CelestialWonders #SeniorAstronomy ,18.0,35.0, UK,2023,7,17,22
2023-07-18 16:30:00,attended local jazz festival tapping toes tunes stood test time music lifelong love affair jazzfestival seniormusiclover, Joy , SeniorJazzFestivalGoer , Facebook , #TimelessTunes #SeniorJazz ,25.0,50.0, USA,2023,7,18,16
2023-07-19 19:45:00,started blog sharing wisdom gained years proving every day chance learn grow seniorwisdom blog, Gratitude , WisdomBloggerSenior , Instagram , #LifeLessons #SeniorBlog ,22.0,45.0, UK,2023,7,19,19
2023-07-20 17:00:00,participated charity run proving age barrier supporting meaningful causes charityrun seniorrunner, Excitement , SeniorCharityRunner , Twitter , #RunForACause #SeniorSupport ,30.0,60.0, Canada,2023,7,20,17
2023-08-01 13:30:00,survived challenging physics exam equations defeat me, Relief , PhysicsWhizHighSchool , Instagram , #PhysicsSurvivor #HighSchoolAdventures ,20.0,40.0, USA,2023,8,1,13
2023-08-02 14:45:00,exploring world coding debugging adventure own codingjourney highschoolcoder, Excitement , CodeExplorerHighSchool , Twitter , #CodingAdventure #HighSchoolCoderLife ,25.0,50.0, UK,2023,8,2,14
