timestamp,text,sentiment,user,platform,hashtags,retweets,likes,country,year,month,day,hour
2020-06-10 10:05:00,free spirit soaring wings dreams leaving trails independence azure sky boundless possibilities, Free-spirited , DreamSoarer , Twitter , #FreeSpirit #WingsOfDreams ,22.0,44.0, UK ,2020,6,10,10
2022-04-01 18:30:00,bathed golden hues gratefulness sunset appreciation casting warm glow landscapes heart, Grateful , SunsetAdmirer , Instagram , #Grateful #GoldenHues ,19.0,38.0, Australia ,2022,4,1,18
2021-01-15 13:00:00,confident strides dance life ballroom selfassuredness leads twirling challenges grace, Confident , DanceStrider , Facebook , #Confident #DanceOfLife ,23.0,46.0, Canada ,2021,1,15,13
2023-05-06 07:20:00,hopeful whispers wind carrying promises brighter tomorrow symphony optimism air possibilities, Hopeful , WindWhisperer , Twitter , #Hopeful #BrighterTomorrows ,15.0,30.0, India ,2023,5,6,7
2019-11-18 15:15:00,playfully juggling responsibilities circus performer balancing acts work joy tossing laughter air, Playful , JugglingArtist , Instagram , #Playful #JugglingResponsibilities ,25.0,50.0, USA ,2019,11,18,15
2020-08-29 20:45:00,whispering tales inspiration stars storyteller crafting constellations threads imagination, Inspired , StarStoryteller , Facebook , #Inspired #TalesToTheStars ,14.0,28.0, UK ,2020,8,29,20
2022-10-30 11:40:00,charting course waves hopeful anticipation sailor steering towards shores dreams yet unexplored, Hopeful , WaveNavigator , Twitter , #Hopeful #SailorOfDreams ,17.0,34.0, Australia ,2022,10,30,11
2021-07-01 12:10:00,compassionate rain tears empathy falling gently nurturing seeds kindness garden human connections, Compassionate , RainNurturer , Instagram , #Compassionate #TearsOfEmpathy ,21.0,42.0, Canada ,2021,7,1,12
2020-01-05 08:45:00,proudly scaling peaks achievement mountaineer conquering challenges planting flag success, Proud , PeakConqueror , Twitter , #Proud #ScalingPeaks ,23.0,46.0, USA ,2020,1,5,8
2022-07-17 06:15:00,embraced hopeful dawn gardener sowing seeds optimism tending blooms brighter tomorrow, Hopeful , DawnGardener , Instagram , #Hopeful #SeedsOfOptimism ,14.0,28.0, UK ,2022,7,17,6
2018-08-22 17:20:00,playful escapade carnival life carousel laughter cotton candy dreams swirling joyous atmosphere, Playful , CarnivalDreamer , Facebook , #Playful #CarnivalEscapade ,24.0,48.0, Australia ,2018,8,22,17
2021-12-08 14:30:00,floating clouds inspiration artist painting sky strokes creativity creating masterpiece dreams, Inspired , SkyArtist , Twitter , #Inspired #CloudsOfCreativity ,18.0,36.0, India ,2021,12,8,14
2019-04-27 09:50:00,navigating river contentment serene boat cruise tranquil waters inner peace acceptance, Contentment , RiverNavigator , Instagram , #Contentment #TranquilWaters ,20.0,40.0, Canada ,2019,4,27,9
2023-09-03 21:40:00,empathy lantern wandering dark alleys sorrow illuminating path compassion care, Empathetic , LanternWanderer , Facebook , #Empathetic #LanternOfCompassion ,16.0,32.0, USA ,2023,9,3,21
2020-06-10 10:05:00,free spirit soaring wings dreams leaving trails independence azure sky boundless possibilities, Free-spirited , DreamSoarer , Twitter , #FreeSpirit #WingsOfDreams ,22.0,44.0, UK ,2020,6,10,10
2022-04-01 18:30:00,bathed golden hues gratefulness sunset appreciation casting warm glow landscapes heart, Grateful , SunsetAdmirer , Instagram , #Grateful #GoldenHues ,19.0,38.0, Australia ,2022,4,1,18
2021-01-15 13:00:00,confident strides dance life ballroom selfassuredness leads twirling challenges grace, Confident , DanceStrider , Facebook , #Confident #DanceOfLife ,23.0,46.0, Canada ,2021,1,15,13
2023-05-06 07:20:00,hopeful whispers wind carrying promises brighter tomorrow symphony optimism air possibilities, Hopeful , WindWhisperer , Twitter , #Hopeful #BrighterTomorrows ,15.0,30.0, India ,2023,5,6,7
2019-11-18 15:15:00,playfully juggling responsibilities circus performer balancing acts work joy tossing laughter air, Playful , JugglingArtist , Instagram , #Playful #JugglingResponsibilities ,25.0,50.0, USA ,2019,11,18,15
2020-08-29 20:45:00,whispering tales inspiration stars storyteller crafting constellations threads imagination, Inspired , StarStoryteller , Facebook , #Inspired #TalesToTheStars ,14.0,28.0, UK ,2020,8,29,20
2022-10-30 11:40:00,charting course waves hopeful anticipation sailor steering towards shores dreams yet unexplored, Hopeful , WaveNavigator , Twitter , #Hopeful #SailorOfDreams ,17.0,34.0, Australia ,2022,10,30,11
2021-07-01 12:10:00,compassionate rain tears empathy falling gently nurturing seeds kindness garden human connections, Compassionate , RainNurturer , Instagram , #Compassionate #TearsOfEmpathy ,21.0,42.0, Canada ,2021,7,1,12
2020-01-05 08:45:00,proudly scaling peaks achievement mountaineer conquering challenges planting flag success, Proud , PeakConqueror , Twitter , #Proud #ScalingPeaks ,23.0,46.0, USA ,2020,1,5,8
2022-07-17 06:15:00,embraced hopeful dawn gardener sowing seeds optimism tending blooms brighter tomorrow, Hopeful , DawnGardener , Instagram , #Hopeful #SeedsOfOptimism ,14.0,28.0, India ,2022,7,17,6
2018-08-22 17:20:00,playful escapade carnival life carousel laughter cotton candy dreams swirling joyous atmosphere, Playful , CarnivalDreamer , Facebook , #Playful #CarnivalEscapade ,24.0,48.0, Australia ,2018,8,22,17
2021-09-15 16:00:00,drowning abyss despair heart shattered fragments lost echoing silence hopelessness, Despair , ShatteredHeart , Instagram , #Despair #EchoingSilence ,8.0,16.0, Canada ,2021,9,15,16
2019-03-08 14:20:00,bitterness festering like venomous vine entwining soul web resentment poisoning garden peace, Bitterness , VenomousSoul , Facebook , #Bitterness #ResentmentWeb ,12.0,24.0, UK ,2019,3,8,14
2017-07-20 11:45:00,wandering desert loneliness step heavy sigh mirages connection shimmering never materializing, Loneliness , DesertWanderer , Twitter , #Loneliness #MiragesOfConnection ,15.0,30.0, USA ,2017,7,20,11
2020-11-02 19:30:00,yearning touch thats there echoes distant warmth haunting heart cold embrace solitude, Yearning , ColdEmbrace , Instagram , #Yearning #DistantWarmth ,10.0,20.0, Australia ,2020,11,2,19
2022-05-12 02:00:00,eyes wide open night fearful shadows dancing walls mind prisoner imagined horrors, Fearful , NightPrisoner , Facebook , #Fearful #ImaginedHorrors ,18.0,36.0, India ,2022,5,12,2
2023-04-08 13:15:00,apprehensive steps tightrope uncertainty balancing act fall seems inevitable anxiety constant companion, Apprehensive , TightropeWalker , Twitter , #Apprehensive #BalancingAct ,14.0,28.0, UK ,2023,4,8,13
2021-06-25 17:50:00,overwhelmed weight world atlas trembling shoulders responsibility boulder landscape exhaustion, Overwhelmed , AtlasBearer , Instagram , #Overwhelmed #BouldersOfExhaustion ,22.0,44.0, Canada ,2021,6,25,17
2019-08-30 10:10:00,jealousy greeneyed monster lurking shadows casting dark cloud sunshine others success, Jealous , GreenMonster , Facebook , #Jealous #GreenEyedMonster ,16.0,32.0, USA ,2019,8,30,10
2022-08-03 15:30:00,devastated storm betrayal wreckage trust scattered like debris heart torn winds broken promises, Devastated , StormSurvivor , Twitter , #Devastated #WindsOfBrokenPromises ,25.0,50.0, Australia ,2022,8,3,15
2020-12-17 09:20:00,frustrated fingers tapping keyboard symphony annoyance composing unsolvable puzzle unmet expectations, Frustrated , PuzzleComposer , Instagram , #Frustrated #UnsolvablePuzzle ,12.0,24.0, India ,2020,12,17,9
2021-02-28 22:45:00,envious eyes fixated gilded prize heartache fueled painful desire possessions seem forever reach, Envious , GildedHeartache , Facebook , #Envious #GildedPrize ,20.0,40.0, USA ,2021,2,28,22
2018-05-10 14:00:00,dismissive glances fortress built indifference walls impenetrable pleas understanding recognition, Dismissive , IndifferentFort , Twitter , #Dismissive #ImpenetrableWalls ,14.0,28.0, UK ,2018,5,10,14
2022-01-07 11:10:00,shattered dreams lie floor like fragments glass mosaic disappointment crafted hands frustration, Frustrated , DreamMosaic , Instagram , #Frustrated #MosaicOfDisappointment ,15.0,30.0, Canada ,2022,1,7,11
2019-09-19 03:30:00,loneliness silent companion night echo chamber solitude hearts solitary nocturne, Loneliness , NocturnalEcho , Facebook , #Loneliness #SolitaryNocturne ,18.0,36.0, Australia ,2019,9,19,3
2023-07-14 23:00:00,fearful whispers dark mind haunted specter unknown shadows dancing rhythm anxietys tune, Fearful , DarkWhispers , Twitter , #Fearful #SpecterOfTheUnknown ,13.0,26.0, UK ,2023,7,14,23
2020-04-05 16:20:00,bitterness bitter aftertaste lingering tongue word reminder wounds refuse heal passing time, Bitterness , LingeringTaste , Instagram , #Bitterness #BitterAftertaste ,10.0,20.0, India ,2020,4,5,16
2021-11-29 08:45:00,overwhelmed cacophony expectations drowning soul tempest pressure struggling stay afloat, Overwhelmed , TempestSurvivor , Facebook , #Overwhelmed #DrowningSoul ,20.0,40.0, USA ,2021,11,29,8
2019-12-12 17:00:00,jealousy venom seeps veins poisoning heart turning breeding ground discontent, Jealous , VenomousHeart , Twitter , #Jealous #HeartOfDiscontent ,16.0,32.0, Australia ,2019,12,12,17
2022-05-20 14:50:00,devastated revelation betrayal trust shattered like fragile glass leaving shards pain wake, Devastated , FragileTrust , Instagram , #Devastated #ShatteredTrust ,25.0,50.0, Canada ,2022,5,20,14
2020-09-03 12:15:00,frustrated attempts mend broken connection threads understanding slipping fingers like grains sand, Frustrated , BrokenThreads , Facebook , #Frustrated #SlippingThreads ,14.0,28.0, UK ,2020,9,3,12
2021-02-10 19:30:00,envious gazes cast upon podium success bitter pill swallowed taste lingering constant reminder unattained heights, Envious , SuccessPill , Twitter , #Envious #BitterPill ,20.0,40.0, USA ,2021,2,10,19
2018-08-18 14:40:00,dismissive gestures curtain drawn shield vulnerability stage emotions take backseat performance indifference, Dismissive , CurtainShield , Instagram , #Dismissive #IndifferencePerformance ,12.0,24.0, Australia ,2018,8,18,14
2022-02-28 21:00:00,despair like heavy fog enveloping every thought blurring path ahead journey labyrinth utter hopelessness, Despair , FoggyLabyrinth , Facebook , #Despair #LabyrinthOfHopelessness ,8.0,16.0, Canada ,2022,2,28,21
2019-10-15 10:30:00,bitterness bitter chill air freezing moments icicles resentment dangle precariously landscape memory, Bitterness , IcyResentment , Twitter , #Bitterness #IciclesOfResentment ,15.0,30.0, UK ,2019,10,15,10
2017-12-01 18:50:00,loneliness solitary moon starless sky casting cold glow landscape isolation echoes bounce empty spaces, Loneliness , SolitaryMoon , Instagram , #Loneliness #StarlessSky ,18.0,36.0, USA ,2017,12,1,18
2020-04-18 16:15:00,yearning warmth vanished sun heartache painted hues sunset never graced horizon, Yearning , VanishedSunset , Facebook , #Yearning #HuesOfSunset ,10.0,20.0, Australia ,2020,4,18,16
2023-01-07 03:30:00,fearful eyes scanning shadows prisoner night terrorized lurking monsters born minds darkest corners, Fearful , NightPrisoner , Twitter , #Fearful #LurkingMonsters ,18.0,36.0, India ,2023,1,7,3
2021-06-10 10:00:00,apprehensive whispers wind forecast uncertainty minds weather vane spinning wildly storm doubt, Apprehensive , WindWhisperer , Instagram , #Apprehensive #StormOfDoubt ,14.0,28.0, Canada ,2021,6,10,10
2020-02-22 15:20:00,overwhelmed maze expectations minotaur pressure lurking labyrinth waiting devour spirit resilience, Overwhelmed , MazeExplorer , Facebook , #Overwhelmed #MinotaurOfPressure ,22.0,44.0, USA ,2020,2,22,15
2018-03-17 14:45:00,jealousy festering wound pain intensifying glance garden others achievements blooming beyond fence, Jealous , WoundedGarden , Twitter , #Jealous #BloomingAchievements ,16.0,32.0, UK ,2018,3,17,14
2022-10-28 11:15:00,devastated heart ruins echoes shattered dreams reverberating chambers requiem whole, Devastated , RuinedHeart , Instagram , #Devastated #EchoesOfShatteredDreams ,25.0,50.0, Australia ,2022,10,28,11
2020-11-01 12:30:00,frustrated attempts untangle knot confusion threads understanding slipping labyrinth miscommunication, Frustrated , KnotUntangler , Facebook , #Frustrated #LabyrinthOfMiscommunication ,14.0,28.0, India ,2020,11,1,12
2021-01-15 22:10:00,envious eyes locked treasure chest opportunities heartache fueled desire keys seem forever elusive, Envious , ElusiveKeys , Twitter , #Envious #DesireForKeys ,20.0,40.0, USA ,2021,1,15,22
2018-08-18 14:00:00,dismissive gestures curtain drawn shield vulnerability stage emotions take backseat performance indifference, Dismissive , IndifferentFort , Instagram , #Dismissive #IndifferencePerformance ,12.0,24.0, Australia ,2018,8,18,14
2022-01-07 11:10:00,shattered dreams lie floor like fragments glass mosaic disappointment crafted hands frustration, Frustrated , DreamMosaic , Twitter , #Frustrated #MosaicOfDisappointment ,15.0,30.0, Canada ,2022,1,7,11
2019-09-19 03:30:00,loneliness silent companion night echo chamber solitude hearts solitary nocturne, Loneliness , NocturnalEcho , Facebook , #Loneliness #SolitaryNocturne ,18.0,36.0, Australia ,2019,9,19,3
2022-04-03 06:15:00,awestruck breathtaking sunrise mountains, Awe           , NatureAdmirer  , Instagram , #Awe #BreathtakingSunrise                   ,28.0,55.0, USA               ,2022,4,3,6
2023-10-12 10:30:00,navigating challenges determination, Determination , GoalPursuer    , Twitter  , #Determination #Challenges                  ,15.0,30.0, Canada            ,2023,10,12,10
2019-06-28 19:00:00,nostalgia hits flipping old photo album, Nostalgia      , MemoryLane     , Facebook , #Nostalgia #OldMemories                     ,22.0,45.0, UK                ,2019,6,28,19
2020-09-15 14:45:00,thrilled witness grandeur cultural festival, Thrill        , CultureEnthusiast , Instagram , #Thrill #CulturalCelebration              ,40.0,80.0, India              ,2020,9,15,14
2017-11-08 21:20:00,calmness found rhythm raindrops windowpane, Calmness      , RainWatcher    , Twitter  , #Calmness #RainyDays                        ,18.0,35.0, Australia          ,2017,11,8,21
2021-05-20 17:30:00,overwhelmed support received personal challenge, Overwhelmed   , PersonalJourney , Facebook , #Overwhelmed #SupportiveCommunity          ,25.0,50.0, USA               ,2021,5,20,17
2023-01-10 12:00:00,excitement builds countdown longawaited vacation begins, Excitement , VacationDreamer , Instagram , #Excitement #VacationCountdown        ,30.0,60.0, France            ,2023,1,10,12
2018-12-05 08:45:00,reflecting lifes journey grateful lessons learned, Gratitude   , LifeLearner   , Twitter  , #Gratitude #LifeLessons                    ,35.0,70.0, Brazil            ,2018,12,5,8
2020-03-15 18:30:00,bittersweet emotions arise bidding farewell dear friend, Bittersweet , FarewellSender , Instagram , #Bittersweet #Farewell                     ,20.0,40.0, Japan             ,2020,3,15,18
2016-08-22 15:10:00,curiosity sparked exploring mysterious ancient ruin, Curiosity     , HistoryExplorer , Facebook , #Curiosity #AncientDiscovery          ,18.0,35.0, Greece            ,2016,8,22,15
2019-08-20 16:00:00,admiration intricate details handcrafted masterpiece, Admiration    , CraftEnthusiast , Instagram , #Admiration #HandcraftedArt               ,25.0,50.0, USA               ,2019,8,20,16
2021-12-08 19:30:00,overjoyed warmth cozy fireplace winter evening, Overjoyed     , WinterLover     , Twitter  , #Overjoyed #WinterWarmth                  ,18.0,35.0, Canada            ,2021,12,8,19
2020-06-10 20:45:00,inspiration strikes observing colors vibrant sunset, Inspiration   , SunsetWatcher   , Instagram , #Inspiration #ColorfulSunset             ,30.0,60.0, UK                ,2020,6,10,20
2022-02-28 07:15:00,motivated achieve fitness goals invigorating workout, Motivation    , FitnessJunkie   , Facebook , #Motivation #FitnessGoals                 ,40.0,80.0, Australia          ,2022,2,28,7
2017-04-15 08:00:00,gratitude simple joys found cup morning coffee, Gratitude     , CoffeeLover     , Twitter  , #Gratitude #MorningCoffee                 ,22.0,45.0, India             ,2017,4,15,8
2018-09-05 14:20:00,feeling empowered conquering challenging hiking trail, Empowerment   , HikingExplorer  , Instagram , #Empowerment #HikingAdventure             ,35.0,70.0, USA               ,2018,9,5,14
2022-10-22 12:45:00,amused antics playful kittens playtime, Amusement     , KittyObserver   , Facebook , #Amusement #PlayfulKittens               ,15.0,30.0, Canada            ,2022,10,22,12
2016-07-02 23:30:00,contemplating lifes mysteries starry night sky, Contemplation , Stargazer       , Twitter  , #Contemplation #StarryNight               ,28.0,55.0, UK                ,2016,7,2,23
2020-11-18 17:10:00,joyful reunion longlost friends years separation, JoyfulReunion , FriendshipRenewal , Instagram , #JoyfulReunion #Friendship               ,20.0,40.0, India             ,2020,11,18,17
2023-03-05 15:00:00,excitement builds preparing surprise celebration, Excitement    , CelebrationPlanner , Facebook , #Excitement #SurpriseCelebration         ,30.0,60.0, Australia          ,2023,3,5,15
2015-12-01 11:30:00,satisfaction derived successfully completing diy project, Satisfaction  , DIYEnthusiast   , Twitter  , #Satisfaction #DIYProject                 ,25.0,50.0, USA               ,2015,12,1,11
2021-09-10 09:45:00,feeling blessed supportive community times need, Blessed       , CommunityHelper , Instagram , #Blessed #SupportiveCommunity            ,18.0,35.0, UK                ,2021,9,10,9
2018-05-12 14:20:00,captivated serenity tranquil garden full bloom, Serenity      , GardenEnthusiast , Facebook , #Serenity #TranquilGarden                ,22.0,45.0, Canada            ,2018,5,12,14
2022-07-25 10:00:00,anticipation upcoming adventure exotic destination, Anticipation  , Wanderlust      , Twitter  , #Anticipation #AdventureAwaits           ,40.0,80.0, India             ,2022,7,25,10
2019-03-08 18:30:00,reflecting personal growth achieved life experiences, Reflection    , GrowthSeeker    , Instagram , #Reflection #PersonalGrowth              ,35.0,70.0, USA               ,2019,3,8,18
2017-01-28 21:15:00,nostalgic memories flood revisiting childhood favorites, Nostalgia     , ChildhoodMemories , Facebook , #Nostalgia #ChildhoodFavorites           ,20.0,40.0, Australia          ,2017,1,28,21
2016-11-14 13:45:00,appreciation vibrant culture experienced travel, Appreciation  , CultureExplorer , Twitter  , #Appreciation #CulturalExperience        ,28.0,55.0, UK                ,2016,11,14,13
2020-04-02 17:30:00,confidence soars overcoming public speaking anxiety, Confidence    , PublicSpeaker   , Instagram , #Confidence #OvercomingAnxiety          ,15.0,30.0, USA               ,2020,4,2,17
2023-01-15 19:00:00,contentment midst family gathering filled laughter, Contentment   , FamilyCelebration , Facebook , #Contentment #FamilyLaughter             ,25.0,50.0, Canada            ,2023,1,15,19
2018-08-07 12:15:00,enthusiasm learning new skills expanding knowledge, Enthusiasm    , LifelongLearner , Twitter  , #Enthusiasm #SkillBuilding               ,30.0,60.0, India             ,2018,8,7,12
2019-10-18 16:45:00,surprise delight discovering hidden gem city, Surprise      , CityExplorer    , Instagram , #Surprise #HiddenGem                      ,18.0,35.0, UK                ,2019,10,18,16
2022-06-30 07:00:00,sense accomplishment completing challenging workout, Accomplishment , FitnessAchiever , Facebook , #Accomplishment #FitnessSuccess         ,22.0,45.0, Australia          ,2022,6,30,7
2017-06-12 18:20:00,wonderment beauty double rainbow rain, Wonderment    , RainbowChaser   , Twitter  , #Wonderment #DoubleRainbow               ,35.0,70.0, USA               ,2017,6,12,18
2021-07-05 09:30:00,optimism bright future amidst challenging times, Optimism      , FutureOptimist  , Instagram , #Optimism #BrightFuture                  ,20.0,40.0, Canada            ,2021,7,5,9
2016-04-15 14:50:00,pride achieving personal milestone career progression, Pride         , CareerAchiever  , Facebook , #Pride #CareerMilestone                  ,28.0,55.0, UK                ,2016,4,15,14
2020-02-10 11:15:00,happiness blooms like flowers garden sunny day, Happiness     , SunnyDayEnthusiast , Twitter  , #Happiness #SunnyDay                      ,15.0,30.0, India             ,2020,2,10,11
2018-09-22 16:30:00,elation discovering rare book quaint bookstore, Elation       , Bookworm        , Instagram , #Elation #RareBookDiscovery              ,40.0,80.0, USA               ,2018,9,22,16
2015-11-08 10:00:00,curiosity piqued mysteries ancient archaeological site, Curiosity   , ArchaeologyEnthusiast , Facebook , #Curiosity #AncientMysteries            ,18.0,35.0, Australia          ,2015,11,8,10
2022-08-10 22:00:00,mesmerized cosmic dance fireflies moonlit night, Enchantment   , NightSkyObserver , Instagram , #Enchantment #CosmicFireflies             ,25.0,50.0, Brazil           ,2022,8,10,22
2019-04-05 17:30:00,intrigued symphony colors abstract art exhibition, Intrigue      , ArtConnoisseur  , Twitter  , #Intrigue #AbstractArt                   ,18.0,35.0, France           ,2019,4,5,17
2020-12-15 15:45:00,giggles joy echo air childrens playdate, PlayfulJoy    , PlayfulParent   , Facebook , #PlayfulJoy #ChildrensPlaydate           ,22.0,45.0, Japan            ,2020,12,15,15
2017-10-20 08:15:00,enveloped serenity practicing mindfulness lake, Mindfulness   , ZenSeeker       , Instagram , #Mindfulness #LakeTranquility            ,35.0,70.0, Canada           ,2017,10,20,8
2021-02-28 13:00:00,chasing dreams like kite soaring high vast open sky, DreamChaser   , SkyDreamer      , Twitter  , #DreamChaser #SkyHighDreams              ,30.0,60.0, Australia         ,2021,2,28,13
2018-06-12 20:30:00,spellbound elegance ballroom dance crystal chandeliers, Elegance , DanceEnthusiast , Facebook , #Elegance #BallroomDance                ,28.0,55.0, UK               ,2018,6,12,20
2016-03-08 14:20:00,whimsical delight world fairy tales magical creatures, Whimsy        , FairyTaleExplorer , Instagram , #Whimsy #MagicalWorld                    ,20.0,40.0, USA             ,2016,3,8,14
2023-04-18 17:10:00,pensive contemplation amid ancient ruins forgotten civilization, Pensive , RuinsExplorer   , Twitter  , #Pensive #AncientCivilization           ,18.0,35.0, Greece           ,2023,4,18,17
2020-07-25 12:45:00,embracing thrill speed rollercoasters exhilarating twists, Thrill      , RollercoasterFan , Facebook , #Thrill #RollercoasterAdventure        ,22.0,45.0, Germany         ,2020,7,25,12
2019-11-30 19:30:00,harmony resonates musicians play melody unity togetherness, Harmony    , MusicHarmonist  , Instagram , #Harmony #MusicalUnity                   ,35.0,70.0, Sweden          ,2019,11,30,19
2015-09-01 16:00:00,burst creativity quiet solitude artists studio, Creativity   , StudioArtist    , Twitter  , #Creativity #ArtistsHaven               ,15.0,30.0, Italy           ,2015,9,1,16
2022-05-05 10:15:00,radiant joy akin blooming flowers sunkissed spring morning, Radiance    , SpringEnthusiast , Facebook , #Radiance #SpringBlooms                 ,25.0,50.0, Netherlands     ,2022,5,5,10
2018-07-08 23:00:00,sense wonder vastness cosmos stargazing night, Wonder     , CosmosExplorer  , Instagram , #Wonder #StargazingAdventure            ,40.0,80.0, South Africa    ,2018,7,8,23
2021-09-20 14:30:00,rejuvenated salty breeze sound waves seaside, Rejuvenation , SeaBreezeLover , Twitter  , #Rejuvenation #SeasideEscape            ,18.0,35.0, Spain           ,2021,9,20,14
2016-11-15 11:45:00,whispers inspiration rustling leaves serene forest, Inspiration , ForestDreamer   , Facebook , #Inspiration #ForestWhispers            ,28.0,55.0, Portugal        ,2016,11,15,11
2020-01-12 18:00:00,savoring warmth cup cocoa chilly winter evening, Coziness     , WinterWarmth    , Instagram , #Coziness #WarmWinterEvening           ,30.0,60.0, Switzerland     ,2020,1,12,18
2017-12-28 19:15:00,heartfelt gratitude laughter shared family reunion, Gratitude  , FamilyGatherer , Facebook , #Gratitude #FamilyLaughter              ,22.0,45.0, Austria         ,2017,12,28,19
2019-03-02 20:20:00,embarking culinary adventure savoring exotic flavors around world, Adventure , CulinaryExplorer , Twitter  , #Adventure #CulinaryJourney             ,35.0,70.0, Belgium         ,2019,3,2,20
2022-06-08 15:30:00,euphoria floods final puzzle piece clicks place, Euphoria   , PuzzleSolver    , Instagram , #Euphoria #PuzzleCompletion            ,20.0,40.0, Denmark         ,2022,6,8,15
2018-08-18 14:45:00,aweinspired grandeur ancient cathedrals intricate architecture, Awe    , CathedralVisitor , Facebook , #Awe #ArchitecturalGrandeur            ,18.0,35.0, Czech Republic  ,2018,8,18,14
2022-08-10 22:00:00,captivated ethereal beauty field filled fireflies, Enchantment   , NightSkyObserver , Instagram , #Enchantment #FireflyField              ,25.0,50.0, Brazil           ,2022,8,10,22
2019-04-05 17:30:00,immersed enchanting melodies street musicians violin, Melodic       , MusicLover      , Twitter  , #Melodic #StreetMusic                   ,18.0,35.0, France           ,2019,4,5,17
2020-12-15 15:45:00,joyful laughter resonates lively summer carnival, FestiveJoy    , CarnivalGoer    , Facebook , #FestiveJoy #SummerCarnival             ,22.0,45.0, Japan            ,2020,12,15,15
2017-10-20 08:15:00,exploring universe within mindful meditation session, InnerJourney  , MindfulExplorer , Instagram , #InnerJourney #MeditationBliss          ,35.0,70.0, Canada           ,2017,10,20,8
2021-02-28 13:00:00,soaring like free spirit winds coastal cliff, Freedom       , CoastalExplorer , Twitter  , #Freedom #CoastalAdventure              ,30.0,60.0, Australia         ,2021,2,28,13
2018-06-12 20:30:00,dazzled elegance masquerade balls dazzling costumes, Dazzle        , MasqueradeAttendee , Facebook , #Dazzle #MasqueradeElegance            ,28.0,55.0, UK               ,2018,6,12,20
