timestamp,text,sentiment,user,platform,hashtags,retweets,likes,country,year,month,day,hour
2018-03-10 09:45:00,arousal excitement muchawaited trip, Arousal       , TravelExcitement, Twitter  , #Arousal #TravelAdventure                     ,20.0,40.0, India    ,2018,3,10,9
2020-09-17 16:30:00,enthusiasm new artistic project works, Enthusiasm    , ArtisticSpirit  , Instagram , #Enthusiasm #ArtisticProject                 ,15.0,30.0, USA       ,2020,9,17,16
2011-08-28 18:45:00,feeling sense fulfillment helping others, Fulfillment   , HelperHeart     , Facebook , #Fulfillment #HelpingOthers                  ,22.0,45.0, Canada    ,2011,8,28,18
2017-11-01 15:30:00,reverence historical significance landmark, Reverence , HistoryBuff     , Twitter  , #Reverence #HistoricalSite                   ,18.0,35.0, Australia ,2017,11,1,15
2019-06-15 10:00:00,elation achieving fitness milestone, Elation       , FitnessAchiever2, Instagram , #Elation #FitnessMilestone                   ,25.0,50.0, UK           ,2019,6,15,10
2022-04-03 11:45:00,euphoria successful product launch, Euphoria      , ProductLaunchJoy, Facebook , #Euphoria #ProductLaunchSuccess              ,15.0,30.0, USA       ,2022,4,3,11
2010-11-12 20:20:00,contentment embrace loved one, Contentment   , LovingEmbrace   , Twitter  , #Contentment #Love                             ,30.0,60.0, India    ,2010,11,12,20
2011-07-22 18:30:00,serenity found beauty sunset sea, Serenity      , SunsetWatcher2  , Instagram , #Serenity #SunsetViews                       ,22.0,45.0, Canada     ,2011,7,22,18
2012-03-30 11:20:00,gratitude small joys day brings, Gratitude     , JoyfulHeart2    , Facebook , #Gratitude #SmallJoys                        ,15.0,30.0, Australia   ,2012,3,30,11
2013-10-05 16:40:00,hopeful potential personal growth, Hope          , GrowthOptimist  , Twitter  , #Hope #PersonalDevelopment                    ,18.0,35.0, UK       ,2013,10,5,16
2014-07-10 13:15:00,empowerment learning new skill, Empowerment   , SkillEmpower    , Instagram , #Empowerment #SkillBuilding                   ,25.0,50.0, India   ,2014,7,10,13
2015-12-18 14:20:00,compassion volunteering local charity, Compassion    , CharityVolunteer, Facebook , #Compassion #VolunteerWork                   ,18.0,35.0, USA      ,2015,12,18,14
2016-02-10 19:45:00,tenderness quiet moment shared pet, Tenderness    , PetLove         , Twitter  , #Tenderness #PetLove                          ,25.0,50.0, Canada   ,2016,2,10,19
2017-09-25 11:30:00,arousal excitement upcoming festival, Arousal       , FestivalFan     , Instagram , #Arousal #FestivalExcitement               ,20.0,40.0, UK ,2017,9,25,11
2018-04-15 16:00:00,enthusiasm diy home improvement project, Enthusiasm    , DIYEnthusiast   , Facebook , #Enthusiasm #HomeImprovement                 ,15.0,30.0, Australia   ,2018,4,15,16
2019-11-28 18:20:00,fulfillment completing challenging puzzle, Fulfillment   , PuzzleMaster    , Twitter  , #Fulfillment #PuzzleChallenge                ,22.0,45.0, India    ,2019,11,28,18
2020-05-11 15:00:00,reverence wonders nature hiking trail, Reverence , NatureAdmirer   , Instagram , #Reverence #NatureExploration                ,18.0,35.0, USA        ,2020,5,11,15
2021-02-05 09:30:00,elation surprise reunion childhood friend, Elation   , ChildhoodJoy    , Facebook , #Elation #FriendshipReunion                  ,25.0,50.0, Canada      ,2021,2,5,9
2021-03-10 08:30:00,suffering despair another setback, Despair         , StrugglingSoul    , Twitter  , #Despair #Struggle                              ,5.0,10.0, USA          ,2021,3,10,8
2022-07-05 15:45:00,overwhelmed grief missing loved one dearly, Grief           , MourningHeart     , Instagram , #Grief #Loss                                   ,8.0,15.0, Canada          ,2022,7,5,15
2019-11-18 21:20:00,loneliness creeps night grows colder, Loneliness      , SolitarySoul      , Facebook , #Loneliness #Isolation                         ,10.0,20.0, UK           ,2019,11,18,21
2020-08-12 11:30:00,jealousy consumes witness others success, Jealousy        , EnviousObserver   , Twitter  , #Jealousy #Envy                               ,12.0,25.0, India        ,2020,8,12,11
2018-05-22 14:45:00,resentment building past betrayals, Resentment      , BitterHeart       , Instagram , #Resentment #Bitterness                       ,7.0,15.0, Australia     ,2018,5,22,14
2017-01-30 16:10:00,frustration mounts obstacles block path, Frustration     , BlockedGoals      , Facebook , #Frustration #Obstacles                       ,10.0,20.0, USA          ,2017,1,30,16
2016-09-28 19:45:00,boredom sets in day feels endlessly dull, Boredom         , BoredMind         , Twitter  , #Boredom #LackOfInterest                     ,8.0,15.0, Canada        ,2016,9,28,19
2019-04-15 09:00:00,anxiety grips heart worry clouds thoughts, Anxiety         , WorriedMind       , Instagram , #Anxiety #Worry                               ,12.0,25.0, UK           ,2019,4,15,9
2021-12-03 18:30:00,intimidation unknown future ahead, Intimidation    , FearfulSoul       , Facebook , #Intimidation #Fear                           ,15.0,30.0, India        ,2021,12,3,18
2020-06-20 14:20:00,helplessness sinks challenges pile up, Helplessness    , OverwhelmedHeart  , Twitter  , #Helplessness #Overwhelmed                    ,8.0,15.0, Australia    ,2020,6,20,14
2018-11-07 11:30:00,envy eats away see others prosperity, Envy            , CovetousMind     , Instagram , #Envy #Desire                                ,10.0,20.0, Canada        ,2018,11,7,11
2017-08-25 16:00:00,regret missed opportunities haunts thoughts, Regret         , RemorsefulSoul   , Facebook , #Regret #MissedChances                       ,12.0,25.0, UK           ,2017,8,25,16
2019-02-11 09:45:00,disgust sight injustice cruelty, Disgust         , DisgustedHeart   , Twitter  , #Disgust #Injustice                          ,7.0,15.0, India        ,2019,2,11,9
2016-04-02 20:20:00,drowning despair hope slipping fingers, Despair      , HopelessHeart    , Instagram , #Despair #Hopeless                           ,10.0,20.0, USA          ,2016,4,2,20
2015-10-18 15:30:00,grief weighs heavy tears constant companion, Grief           , TearfulSoul      , Facebook , #Grief #Tears                                ,12.0,25.0, Canada        ,2015,10,18,15
2019-07-12 18:10:00,loneliness crowded room silent cry connection, Loneliness , IsolatedMind     , Twitter  , #Loneliness #SeekingConnection              ,15.0,30.0, UK            ,2019,7,12,18
2018-06-03 16:30:00,jealousy gnaws confidence toxic emotion, Jealousy        , SelfDoubt        , Instagram , #Jealousy #Insecurity                       ,8.0,15.0, India         ,2018,6,3,16
2022-01-15 12:00:00,resentment festers poisoning relationships, Resentment      , BrokenTrust      , Facebook , #Resentment #BrokenTrust                     ,10.0,20.0, Australia    ,2022,1,15,12
2017-04-10 14:45:00,frustration boils over volcanic eruption emotions, Frustration , ExplosiveMind    , Twitter  , #Frustration #EmotionalOutburst             ,12.0,25.0, USA          ,2017,4,10,14
2016-11-28 19:00:00,boredom settles like dust life feels mundane, Boredom         , MundaneHeart     , Instagram , #Boredom #Monotony                          ,7.0,15.0, Canada        ,2016,11,28,19
2018-09-05 09:30:00,anxiety grips chest relentless grip thoughts, Anxiety   , RestlessMind     , Facebook , #Anxiety #Restlessness                      ,10.0,20.0, UK            ,2018,9,5,9
2021-10-22 18:30:00,intimidation challenges ahead fear takes hold, Intimidation , FearfulJourney   , Twitter  , #Intimidation #FacingFear                   ,15.0,30.0, India         ,2021,10,22,18
2019-05-08 14:20:00,helplessness engulfs me drowning sea problems, Helplessness , OverwhelmedSoul  , Instagram , #Helplessness #Struggling                   ,8.0,15.0, Australia    ,2019,5,8,14
2017-03-20 11:30:00,envy poisons thoughts coveting others success, Envy            , GreenEyedMonster , Facebook , #Envy #Success                              ,10.0,20.0, Canada        ,2017,3,20,11
2018-12-15 16:00:00,regret decisions led painful present, Regret         , RegretfulMind    , Twitter  , #Regret #PastChoices                        ,12.0,25.0, USA          ,2018,12,15,16
2016-07-01 09:45:00,disgust corruption stains society, Disgust         , CorruptedHeart   , Instagram , #Disgust #Corruption                        ,7.0,15.0, UK            ,2016,7,1,9
2020-08-20 20:20:00,sinking despair day darker last, Despair         , DrowningSoul     , Facebook , #Despair #DarkDays                          ,10.0,20.0, India         ,2020,8,20,20
2021-02-25 15:30:00,grief overwhelms storm emotions within, Grief           , StormyHeart      , Twitter  , #Grief #EmotionalStorm                      ,12.0,25.0, Canada        ,2021,2,25,15
2019-09-12 18:10:00,loneliness echoes empty spaces yearning connection, Loneliness , EchoingSoul     , Instagram , #Loneliness #YearningForConnection         ,15.0,30.0, Australia     ,2019,9,12,18
2018-08-05 16:30:00,jealousy poisons thoughts resentment brewing within, Jealousy    , PoisonedMind    , Facebook , #Jealousy #Resentment                       ,8.0,15.0, USA           ,2018,8,5,16
2017-01-12 12:00:00,resentment festers wound refuses heal, Resentment      , UnforgivingSoul  , Twitter  , #Resentment #Unforgiving                    ,10.0,20.0, India         ,2017,1,12,12
2022-04-05 14:45:00,frustration escalates thunderstorm emotions, Frustration     , ThunderingMind   , Instagram , #Frustration #EmotionalOutburst            ,12.0,25.0, UK            ,2022,4,5,14
2021-10-02 19:00:00,boredom lingers stagnant pool indifference, Boredom         , StagnantHeart    , Facebook , #Boredom #Stagnation                        ,7.0,15.0, Canada        ,2021,10,2,19
2023-04-15 10:15:00,embarking journey discovery fueled curiosity thirst knowledge, Curiosity       , InquisitiveMind   , Twitter  , #Curiosity #Learning                        ,15.0,30.0, USA          ,2023,4,15,10
2022-11-28 17:30:00,lost vast sea information indifferent wave digital ocean, Indifference    , ApatheticObserver , Instagram , #Indifference #DigitalOverload              ,7.0,15.0, Canada          ,2022,11,28,17
2020-04-02 09:45:00,complex puzzle life leaves state perpetual confusion seeking answers chaos, Confusion       , SeekingClarity    , Facebook , #Confusion #LifePuzzle                     ,10.0,20.0, UK           ,2020,4,2,9
2021-08-10 14:00:00,numbness settles me shield overwhelming emotions life throws way, Numbness        , EmotionallyDistant , Twitter  , #Numbness #EmotionalShield                 ,8.0,15.0, India        ,2021,8,10,14
2019-06-18 20:45:00,gazing sunset melancholic longing moments slip fingers time, Melancholy      , SunsetDreamer     , Instagram , #Melancholy #SunsetMoments                 ,12.0,25.0, Australia     ,2019,6,18,20
2018-02-05 15:15:00,revisiting old photographs caught embrace nostalgias bittersweet symphony, Nostalgia       , MemoryLaneTraveler , Facebook , #Nostalgia #MemoryLane                     ,10.0,20.0, USA          ,2018,2,5,15
2022-05-30 11:30:00,torn conflicting emotions ambivalence paints decisions shades uncertainty, Ambivalence     , MixedFeelings     , Twitter  , #Ambivalence #UncertainChoices             ,12.0,25.0, Canada        ,2022,5,30,11
2023-01-10 16:20:00,embracing ebb flow life finding acceptance dance existence, Acceptance      , ZenLifestyle      , Instagram , #Acceptance #LifeJourney                   ,15.0,30.0, UK           ,2023,1,10,16
2020-09-18 13:45:00,facing challenges headon determination fuels fire within achieve impossible, Determination   , ResilientSpirit   , Facebook , #Determination #AchieveTheImpossible       ,10.0,20.0, India        ,2020,9,18,13
2021-07-03 19:00:00,serenity found stillness nature tranquil retreat chaos modern world, Serenity        , NatureSoul        , Twitter  , #Serenity #NatureRetreat                   ,12.0,25.0, Australia    ,2021,7,3,19
2022-10-08 08:15:00,curiosity leading rabbit hole knowledge perpetual student lifes classroom, Curiosity       , EternalLearner    , Instagram , #Curiosity #KnowledgeQuest                ,20.0,40.0, USA          ,2022,10,8,8
2023-03-22 16:30:00,floating day air indifference detached mundane happenings around, Indifference    , AloofObserver     , Facebook , #Indifference #FloatingThroughLife        ,10.0,20.0, Canada        ,2023,3,22,16
2021-05-15 11:45:00,entangled web thoughts confusion reigning navigate labyrinth ideas, Confusion       , ThoughtExplorer   , Twitter  , #Confusion #ThoughtLabyrinth              ,15.0,30.0, UK            ,2021,5,15,11
2019-12-28 14:30:00,numb chaos emotions locked away stoic facade concealing inner turmoil, Numbness        , StoicSoul         , Instagram , #Numbness #StoicFacade                    ,8.0,15.0, Australia     ,2019,12,28,14
2020-03-01 19:00:00,melancholy whispers breeze silent conversation echoes forgotten dreams, Melancholy      , DreamerInSilence  , Facebook , #Melancholy #WhispersInTheBreeze         ,12.0,25.0, India         ,2020,3,1,19
2018-07-10 15:45:00,stumbling upon old journal nostalgia flooding waves carrying moments long gone, Nostalgia       , JournalKeeper     , Twitter  , #Nostalgia #JournalMoments               ,10.0,20.0, Canada        ,2018,7,10,15
2022-01-05 10:30:00,tapestry conflicting feelings weaving uncertainty caught threads ambivalence, Ambivalence     , ThreadWeaver      , Instagram , #Ambivalence #ConflictingFeelings        ,12.0,25.0, UK            ,2022,1,5,10
2021-08-20 16:20:00,embracing flaws finding acceptance imperfection journey towards selflove, Acceptance      , SelfLoveAdvocate  , Facebook , #Acceptance #SelfLoveJourney              ,15.0,30.0, Australia    ,2021,8,20,16
2019-11-03 13:45:00,determination burning like wildfire overcoming obstacles turning dreams reality, Determination   , DreamChaser       , Twitter  , #Determination #DreamsIntoReality        ,18.0,35.0, USA          ,2019,11,3,13
2020-04-12 19:30:00,tranquil moments ocean serenity washing over peaceful retreat within waves embrace, Serenity        , OceanSoul         , Instagram , #Serenity #OceanRetreat                   ,25.0,50.0, Canada        ,2020,4,12,19
2022-04-15 08:45:00,exploring new horizons spark curiosity adventurer vast landscape knowledge, Curiosity       , HorizonExplorer   , Facebook , #Curiosity #NewHorizons                  ,22.0,45.0, India         ,2022,4,15,8
2023-02-10 17:00:00,drifting day nonchalant demeanor embracing art indifference, Indifference    , NonchalantSpirit  , Twitter  , #Indifference #DriftingThroughLife       ,9.0,18.0, UK            ,2023,2,10,17
2020-08-05 12:15:00,wrestling thoughts perplexed mind lost labyrinth lifes complexities, Confusion       , ComplexThinker    , Instagram , #Confusion #PerplexedMind                ,14.0,28.0, Australia    ,2020,8,5,12
2021-12-01 15:30:00,immersed state emotional numbness shield storm daily struggles, Numbness        , ShieldedHeart     , Facebook , #Numbness #EmotionalShield               ,10.0,20.0, USA          ,2021,12,1,15
2019-03-25 21:00:00,melancholic symphony playing background soundtrack wistful heart, Melancholy      , SymphonySoul      , Twitter  , #Melancholy #WistfulHeart                ,13.0,26.0, Canada        ,2019,3,25,21
2017-06-18 14:45:00,flipping pages old yearbook nostalgia painting smiles tears face, Nostalgia       , YearbookExplorer  , Instagram , #Nostalgia #YearbookMemories            ,12.0,25.0, India         ,2017,6,18,14
2022-07-08 11:30:00,torn opposing emotions ambivalence colors decisions shades uncertainty, Ambivalence     , DecisiveDilemma   , Facebook , #Ambivalence #ShadesOfUncertainty       ,15.0,30.0, Australia    ,2022,7,8,11
2023-05-15 16:20:00,embracing lifes imperfections finding acceptance journey scars all, Acceptance      , ImperfectHarmony  , Twitter  , #Acceptance #ImperfectJourney            ,18.0,36.0, Canada        ,2023,5,15,16
2021-09-10 14:45:00,fiery determination burning within fueled vision reaching unparalleled heights, Determination   , VisionarySpirit   , Instagram , #Determination #UnparalleledHeights      ,20.0,40.0, UK            ,2021,9,10,14
2020-02-28 18:30:00,basking serenity quiet forest whispers nature bring peace soul, Serenity        , ForestDreamer     , Facebook , #Serenity #NatureWhispers                ,25.0,50.0, USA          ,2020,2,28,18
2023-03-10 16:30:00,indifferent noise world silent observer midst lifes cacophony, Indifference    , SilentSpectator   , Instagram , #Indifference #SilentObserver            ,9.0,18.0, India         ,2023,3,10,16
2021-05-02 11:45:00,navigating labyrinth thoughts confusion constant companion maze ideas, Confusion       , MazeNavigator     , Facebook , #Confusion #ThoughtLabyrinth              ,14.0,28.0, Australia    ,2021,5,2,11
2019-10-18 14:30:00,impenetrable numbness shields emotional storms fortress stoic resilience, Numbness        , ResilientFortress , Twitter  , #Numbness #StoicResilience               ,11.0,22.0, UK            ,2019,10,18,14
2020-01-05 20:00:00,melancholy painting world hues nostalgia canvas bittersweet memories, Melancholy      , CanvasDreamer     , Instagram , #Melancholy #BittersweetMemories         ,13.0,26.0, USA          ,2020,1,5,20
2018-08-10 15:45:00,journey past flipping pages old diary nostalgia taking lead, Nostalgia       , DiaryExplorer     , Facebook , #Nostalgia #DiaryJourney                 ,12.0,25.0, Canada        ,2018,8,10,15
2022-01-15 10:30:00,ambivalence clouding decisions caught crossroads conflicting emotions, Ambivalence     , CrossroadsTraveler , Twitter  , #Ambivalence #ConflictingEmotions        ,15.0,30.0, India         ,2022,1,15,10
2021-07-20 16:20:00,embracing imperfections finding acceptance mosaic lifes beautiful chaos, Acceptance      , MosaicDreamer     , Instagram , #Acceptance #BeautifulChaos              ,18.0,36.0, Australia     ,2021,7,20,16
2019-12-03 13:45:00,determination driving force propelling forward path extraordinary achievements, Determination   , PathfinderSpirit  , Facebook , #Determination #ExtraordinaryPath        ,20.0,40.0, USA          ,2019,12,3,13
2020-04-12 19:30:00,seeking serenity melody raindrops tranquil escape noise everyday life, Serenity        , RaindropHarmony   , Twitter  , #Serenity #RaindropMelody                ,25.0,50.0, Canada        ,2020,4,12,19
2022-05-08 08:45:00,curiosity driving exploration unknown seeker knowledge uncharted territories, Curiosity       , SeekerOfUnknowns  , Instagram , #Curiosity #SeekerOfKnowledge            ,22.0,45.0, UK            ,2022,5,8,8
2023-02-22 17:00:00,drifting day air nonchalance indifferent trivialities life, Indifference    , NonchalantWanderer, Facebook , #Indifference #DriftingThroughLife       ,9.0,18.0, India         ,2023,2,22,17
2020-06-05 12:15:00,lost labyrinth thoughts confusion casting shadows quest clarity, Confusion       , ShadowedSeeker    , Twitter  , #Confusion #LabyrinthOfThoughts          ,14.0,28.0, Australia    ,2020,6,5,12
2021-11-30 15:30:00,wrapped cloak emotional numbness shield storms lifes turbulence, Numbness        , TurbulentShield   , Instagram , #Numbness #EmotionalStorms               ,10.0,20.0, Canada        ,2021,11,30,15
2019-02-25 21:00:00,melancholy companion painting canvas life brushstrokes wistful yearning, Melancholy      , WistfulPainter    , Facebook , #Melancholy #WistfulYearning             ,13.0,26.0, UK            ,2019,2,25,21
2017-05-18 14:45:00,leafing pages old photo album nostalgia weaving tales laughter tears, Nostalgia       , TaleWeaver        , Twitter  , #Nostalgia #PhotoAlbumStories            ,12.0,25.0, USA          ,2017,5,18,14
2022-08-05 11:30:00,ambivalence air caught crossroads conflicting emotions decisions, Ambivalence     , CrossroadsExplorer, Instagram , #Ambivalence #CrossroadsConfusion        ,15.0,30.0, Canada        ,2022,8,5,11
2023-06-15 16:20:00,embracing beauty imperfections finding acceptance mosaic lifes unpredictable art, Acceptance      , MosaicArtist      , Facebook , #Acceptance #UnpredictableArt            ,18.0,36.0, Australia    ,2023,6,15,16
2021-10-10 14:45:00,determination ablaze forging path challenges sculpting dreams tangible realities, Determination   , DreamSculptor     , Twitter  , #Determination #SculptingDreams          ,20.0,40.0, UK            ,2021,10,10,14
2020-05-12 19:30:00,immerse serenity moonlit night quiet whispers nature bring peace soul, Serenity        , MoonlitSoul       , Instagram , #Serenity #MoonlitPeace                  ,25.0,50.0, USA          ,2020,5,12,19
2022-12-01 09:15:00,fueled curiosity venturing uncharted realms fearless explorer mysteries world, Curiosity       , FearlessExplorer  , Facebook , #Curiosity #FearlessExplorer              ,22.0,44.0, India         ,2022,12,1,9
2021-11-30 15:30:00,wrapped cloak emotional numbness shield storms lifes turbulence, Numbness , TurbulentShield , Instagram , #Numbness #EmotionalStorms ,10.0,20.0, Canada ,2021,11,30,15
2018-07-12 17:45:00,dancing life exuberance carefree spirit embracing joy zest every turn, Zest , JoyfulDancer , Twitter , #Zest #CarefreeSpirit ,15.0,30.0, USA ,2018,7,12,17
2020-09-05 20:10:00,basking golden glow contentment serene river flowing landscape heart, Contentment , SereneBasker , Facebook , #Contentment #GoldenGlow ,18.0,36.0, Australia ,2020,9,5,20
2022-04-18 08:00:00,gazing towards horizon hopeful eyes painting canvas dreams illuminated sun optimism, Hopeful , DreamPainter , Instagram , #Hopeful #CanvasOfDreams ,12.0,24.0, India ,2022,4,18,8
2019-12-10 12:20:00,standing tall proud oak branches achievement reaching towards sky accomplishment, Proud , OakAchiever , Twitter , #Proud #BranchesOfAchievement ,25.0,50.0, Canada ,2019,12,10,12
2023-02-28 09:45:00,heart overflowing gratitude garden appreciation blooms soil kindness connection, Grateful , HeartGardener , Facebook , #Grateful #BlossomingConnection ,20.0,40.0, USA ,2023,2,28,9
2018-04-03 14:15:00,extending hand empathetic threads weaving tapestry understanding embracing joys sorrows others, Empathetic , ThreadWeaver , Instagram , #Empathetic #TapestryOfUnderstanding ,15.0,30.0, UK ,2018,4,3,14
2022-06-20 10:30:00,compassionate clouds heavy care showering empathy parched grounds human suffering, Compassionate , CloudCaretaker , Twitter , #Compassionate #ShowerOfEmpathy ,18.0,36.0, Australia ,2022,6,20,10
2020-07-08 18:00:00,playfully dancing rain laughter whimsical spirit twirling puddles joy lightheartedness, Playful , RainDancer , Facebook , #Playful #DanceInTheRain ,22.0,44.0, Canada ,2020,7,8,18
2021-08-15 11:10:00,soaring wings free spirit unburdened chains conformity painting sky independence, Free-spirited , SkyPainter , Instagram , #FreeSpirit #PaintingTheSky ,20.0,40.0, India ,2021,8,15,11
2019-10-25 16:50:00,bathed glow inspiration creative phoenix rising ashes ordinary thoughts explore new realms, Inspired , PhoenixExplorer , Twitter , #Inspired #CreativePhoenix ,15.0,30.0, UK ,2019,10,25,16
2023-10-05 07:30:00,navigating sea hope sailing towards sunrise possibilities confident ship positive anticipation, Hopeful , SunriseNavigator , Facebook , #Hopeful #SunriseOfPossibilities ,12.0,24.0, USA ,2023,10,5,7
2022-02-15 13:15:00,striding confidence footprints selfassuredness imprinted sands challenges conquered victories claimed, Confident , SandStrider , Instagram , #Confident #FootprintsOfAssuredness ,25.0,50.0, Australia ,2022,2,15,13
2021-05-08 22:00:00,lost symphony night moonlit serenade whispers tales wanderlust moonlit dreams, Serenity , NightSerenader , Twitter , #Serenity #MoonlitSerenade ,13.0,26.0, Canada ,2021,5,8,22
2020-11-29 14:45:00,unveiling layers curiosity labyrinth questions leading treasure troves undiscovered knowledge, Curiosity , KnowledgeSeeker , Instagram , #Curiosity #LabyrinthOfQuestions ,17.0,34.0, USA ,2020,11,29,14
2019-09-14 10:20:00,embrace autumn breeze leaves ambivalence dancing waltz choices uncertainties, Ambivalence , BreezeWaltzer , Facebook , #Ambivalence #AutumnWaltz ,14.0,28.0, UK ,2019,9,14,10
2022-03-12 19:55:00,gratitude guiding star navigating constellation blessings vast universe lifes precious moments, Grateful , StarNavigator , Twitter , #Grateful #GuidingStar ,19.0,38.0, Australia ,2022,3,12,19
2023-03-30 16:30:00,zestful heart sprinting fields enthusiasm chasing sunbeams laughter meadows joy, Zest , MeadowSprinter , Instagram , #Zest #FieldsOfEnthusiasm ,16.0,32.0, India ,2023,3,30,16
2021-07-01 12:10:00,compassionate rain tears empathy falling gently nurturing seeds kindness garden human connections, Compassionate , RainNurturer , Facebook , #Compassionate #TearsOfEmpathy ,21.0,42.0, Canada ,2021,7,1,12
2020-01-05 08:45:00,proudly scaling peaks achievement mountaineer conquering challenges planting flag success, Proud , PeakConqueror , Twitter , #Proud #ScalingPeaks ,23.0,46.0, USA ,2020,1,5,8
2022-07-17 06:15:00,embraced hopeful dawn gardener sowing seeds optimism tending blooms brighter tomorrow, Hopeful , DawnGardener , Instagram , #Hopeful #SeedsOfOptimism ,14.0,28.0, UK ,2022,7,17,6
2018-08-22 17:20:00,playful escapade carnival life carousel laughter cotton candy dreams swirling joyous atmosphere, Playful , CarnivalDreamer , Facebook , #Playful #CarnivalEscapade ,24.0,48.0, Australia ,2018,8,22,17
2021-12-08 14:30:00,floating clouds inspiration artist painting sky strokes creativity creating masterpiece dreams, Inspired , SkyArtist , Twitter , #Inspired #CloudsOfCreativity ,18.0,36.0, India ,2021,12,8,14
2019-04-27 09:50:00,navigating river contentment serene boat cruise tranquil waters inner peace acceptance, Contentment , RiverNavigator , Instagram , #Contentment #TranquilWaters ,20.0,40.0, Canada ,2019,4,27,9
2023-09-03 21:40:00,empathy lantern wandering dark alleys sorrow illuminating path compassion care, Empathetic , LanternWanderer , Facebook , #Empathetic #LanternOfCompassion ,16.0,32.0, USA ,2023,9,3,21
